{
  "after": {
    "overall_gate": "PASS"
  },
  "before": {},
  "deltas": {},
  "notes": [
    "Stage 001b caveat preserved: DCProjectionTo1D is INHERITED_PASS from finite-frequency xxx projection plus the archived 1D DC notebook pipeline, not a direct full tensorial DC-series PASS."
  ],
  "stage_name": "003_xxx_projection_benchmark_hardening"
}
